{
  "packet_id": "FP-P2D-045",
  "case_id": "series_notna_mixed_missing_hardened",
  "mode": "hardened",
  "operation": "series_notna",
  "left": {
    "name": "vals",
    "index": [
      { "kind": "utf8", "value": "r1" },
      { "kind": "utf8", "value": "r2" },
      { "kind": "utf8", "value": "r3" },
      { "kind": "utf8", "value": "r4" },
      { "kind": "utf8", "value": "r5" },
      { "kind": "utf8", "value": "r6" }
    ],
    "values": [
      { "kind": "int64", "value": 1 },
      { "kind": "null", "value": "null" },
      { "kind": "null", "value": "na_n" },
      { "kind": "float64", "value": 2.5 },
      { "kind": "float64", "value": 3.0 },
      { "kind": "null", "value": "na_t" }
    ]
  },
  "expected_series": {
    "index": [
      { "kind": "utf8", "value": "r1" },
      { "kind": "utf8", "value": "r2" },
      { "kind": "utf8", "value": "r3" },
      { "kind": "utf8", "value": "r4" },
      { "kind": "utf8", "value": "r5" },
      { "kind": "utf8", "value": "r6" }
    ],
    "values": [
      { "kind": "bool", "value": true },
      { "kind": "bool", "value": false },
      { "kind": "bool", "value": false },
      { "kind": "bool", "value": true },
      { "kind": "bool", "value": true },
      { "kind": "bool", "value": false }
    ]
  }
}
