{
  "packet_id": "FP-P2D-042",
  "case_id": "series_value_counts_utf8_ties_hardened",
  "mode": "hardened",
  "operation": "series_value_counts",
  "left": {
    "name": "vals",
    "index": [
      { "kind": "utf8", "value": "r1" },
      { "kind": "utf8", "value": "r2" },
      { "kind": "utf8", "value": "r3" },
      { "kind": "utf8", "value": "r4" },
      { "kind": "utf8", "value": "r5" },
      { "kind": "utf8", "value": "r6" }
    ],
    "values": [
      { "kind": "utf8", "value": "b" },
      { "kind": "utf8", "value": "a" },
      { "kind": "utf8", "value": "b" },
      { "kind": "utf8", "value": "a" },
      { "kind": "utf8", "value": "c" },
      { "kind": "null", "value": "null" }
    ]
  },
  "expected_series": {
    "index": [
      { "kind": "utf8", "value": "b" },
      { "kind": "utf8", "value": "a" },
      { "kind": "utf8", "value": "c" }
    ],
    "values": [
      { "kind": "int64", "value": 2 },
      { "kind": "int64", "value": 2 },
      { "kind": "int64", "value": 1 }
    ]
  }
}
