{
  "packet_id": "FP-P2D-043",
  "case_id": "series_sort_values_numeric_ascending_na_last_strict",
  "mode": "strict",
  "operation": "series_sort_values",
  "left": {
    "name": "vals",
    "index": [
      { "kind": "utf8", "value": "r1" },
      { "kind": "utf8", "value": "r2" },
      { "kind": "utf8", "value": "r3" },
      { "kind": "utf8", "value": "r4" },
      { "kind": "utf8", "value": "r5" }
    ],
    "values": [
      { "kind": "int64", "value": 3 },
      { "kind": "null", "value": "null" },
      { "kind": "int64", "value": 1 },
      { "kind": "int64", "value": 2 },
      { "kind": "null", "value": "na_n" }
    ]
  },
  "expected_series": {
    "index": [
      { "kind": "utf8", "value": "r3" },
      { "kind": "utf8", "value": "r4" },
      { "kind": "utf8", "value": "r1" },
      { "kind": "utf8", "value": "r2" },
      { "kind": "utf8", "value": "r5" }
    ],
    "values": [
      { "kind": "int64", "value": 1 },
      { "kind": "int64", "value": 2 },
      { "kind": "int64", "value": 3 },
      { "kind": "null", "value": "null" },
      { "kind": "null", "value": "null" }
    ]
  }
}
