{
  "packet_id": "FP-P2D-041",
  "case_id": "series_all_numeric_truthy_hardened",
  "mode": "hardened",
  "operation": "series_all",
  "left": {
    "name": "vals",
    "index": [
      { "kind": "utf8", "value": "r1" },
      { "kind": "utf8", "value": "r2" },
      { "kind": "utf8", "value": "r3" },
      { "kind": "utf8", "value": "r4" },
      { "kind": "utf8", "value": "r5" }
    ],
    "values": [
      { "kind": "int64", "value": 1 },
      { "kind": "int64", "value": -3 },
      { "kind": "float64", "value": 2.5 },
      { "kind": "bool", "value": true },
      { "kind": "null", "value": "null" }
    ]
  },
  "expected_bool": true
}
