{
  "packet_id": "FP-P2D-045",
  "case_id": "series_isna_all_present_hardened",
  "mode": "hardened",
  "operation": "series_isna",
  "left": {
    "name": "vals",
    "index": [
      { "kind": "int64", "value": 0 },
      { "kind": "int64", "value": 1 },
      { "kind": "int64", "value": 2 }
    ],
    "values": [
      { "kind": "int64", "value": 10 },
      { "kind": "int64", "value": 20 },
      { "kind": "int64", "value": 30 }
    ]
  },
  "expected_series": {
    "index": [
      { "kind": "int64", "value": 0 },
      { "kind": "int64", "value": 1 },
      { "kind": "int64", "value": 2 }
    ],
    "values": [
      { "kind": "bool", "value": false },
      { "kind": "bool", "value": false },
      { "kind": "bool", "value": false }
    ]
  }
}
