{
  "packet_id": "FP-P2D-048",
  "case_id": "series_notnull_all_present_strict",
  "mode": "strict",
  "operation": "series_notnull",
  "left": {
    "name": "vals",
    "index": [
      { "kind": "utf8", "value": "r1" },
      { "kind": "utf8", "value": "r2" },
      { "kind": "utf8", "value": "r3" }
    ],
    "values": [
      { "kind": "utf8", "value": "a" },
      { "kind": "utf8", "value": "b" },
      { "kind": "utf8", "value": "c" }
    ]
  },
  "expected_series": {
    "index": [
      { "kind": "utf8", "value": "r1" },
      { "kind": "utf8", "value": "r2" },
      { "kind": "utf8", "value": "r3" }
    ],
    "values": [
      { "kind": "bool", "value": true },
      { "kind": "bool", "value": true },
      { "kind": "bool", "value": true }
    ]
  }
}
