{
  "packet_id": "FP-P2D-041",
  "case_id": "series_any_all_missing_strict",
  "mode": "strict",
  "operation": "series_any",
  "left": {
    "name": "vals",
    "index": [
      { "kind": "utf8", "value": "r1" },
      { "kind": "utf8", "value": "r2" }
    ],
    "values": [
      { "kind": "null", "value": "null" },
      { "kind": "null", "value": "na_n" }
    ]
  },
  "expected_bool": false
}
