{
  "packet_id": "FP-P2D-046",
  "case_id": "series_dropna_all_missing_hardened",
  "mode": "hardened",
  "operation": "series_dropna",
  "left": {
    "name": "vals",
    "index": [
      { "kind": "utf8", "value": "r1" },
      { "kind": "utf8", "value": "r2" },
      { "kind": "utf8", "value": "r3" }
    ],
    "values": [
      { "kind": "null", "value": "null" },
      { "kind": "null", "value": "na_n" },
      { "kind": "null", "value": "na_t" }
    ]
  },
  "expected_series": {
    "index": [],
    "values": []
  }
}
