{
  "packet_id": "FP-P2D-045",
  "case_id": "series_notna_all_present_strict",
  "mode": "strict",
  "operation": "series_notna",
  "left": {
    "name": "vals",
    "index": [
      { "kind": "int64", "value": 0 },
      { "kind": "int64", "value": 1 },
      { "kind": "int64", "value": 2 }
    ],
    "values": [
      { "kind": "utf8", "value": "a" },
      { "kind": "utf8", "value": "b" },
      { "kind": "utf8", "value": "c" }
    ]
  },
  "expected_series": {
    "index": [
      { "kind": "int64", "value": 0 },
      { "kind": "int64", "value": 1 },
      { "kind": "int64", "value": 2 }
    ],
    "values": [
      { "kind": "bool", "value": true },
      { "kind": "bool", "value": true },
      { "kind": "bool", "value": true }
    ]
  }
}
