{
  "packet_id": "FP-P2D-041",
  "case_id": "series_any_mixed_truthy_strict",
  "mode": "strict",
  "operation": "series_any",
  "left": {
    "name": "vals",
    "index": [
      { "kind": "utf8", "value": "r1" },
      { "kind": "utf8", "value": "r2" },
      { "kind": "utf8", "value": "r3" },
      { "kind": "utf8", "value": "r4" },
      { "kind": "utf8", "value": "r5" }
    ],
    "values": [
      { "kind": "int64", "value": 0 },
      { "kind": "int64", "value": 0 },
      { "kind": "int64", "value": 0 },
      { "kind": "int64", "value": 5 },
      { "kind": "null", "value": "null" }
    ]
  },
  "expected_bool": true
}
