{
  "packet_id": "FP-P2C-001",
  "case_id": "series_add_duplicate_labels_hardened",
  "mode": "hardened",
  "operation": "series_add",
  "left": {
    "name": "lhs",
    "index": [
      { "kind": "utf8", "value": "a" },
      { "kind": "utf8", "value": "a" }
    ],
    "values": [
      { "kind": "int64", "value": 1 },
      { "kind": "int64", "value": 2 }
    ]
  },
  "right": {
    "name": "rhs",
    "index": [
      { "kind": "utf8", "value": "a" }
    ],
    "values": [
      { "kind": "int64", "value": 3 }
    ]
  },
  "expected_series": {
    "index": [
      { "kind": "utf8", "value": "a" },
      { "kind": "utf8", "value": "a" }
    ],
    "values": [
      { "kind": "int64", "value": 4 },
      { "kind": "int64", "value": 5 }
    ]
  }
}
