{
  "packet_id": "FP-P2D-042",
  "case_id": "series_value_counts_int_with_nulls_strict",
  "mode": "strict",
  "operation": "series_value_counts",
  "left": {
    "name": "vals",
    "index": [
      { "kind": "utf8", "value": "r1" },
      { "kind": "utf8", "value": "r2" },
      { "kind": "utf8", "value": "r3" },
      { "kind": "utf8", "value": "r4" },
      { "kind": "utf8", "value": "r5" },
      { "kind": "utf8", "value": "r6" },
      { "kind": "utf8", "value": "r7" },
      { "kind": "utf8", "value": "r8" }
    ],
    "values": [
      { "kind": "int64", "value": 2 },
      { "kind": "int64", "value": 1 },
      { "kind": "int64", "value": 2 },
      { "kind": "null", "value": "null" },
      { "kind": "int64", "value": 3 },
      { "kind": "int64", "value": 1 },
      { "kind": "int64", "value": 2 },
      { "kind": "null", "value": "na_n" }
    ]
  },
  "expected_series": {
    "index": [
      { "kind": "int64", "value": 2 },
      { "kind": "int64", "value": 1 },
      { "kind": "int64", "value": 3 }
    ],
    "values": [
      { "kind": "int64", "value": 3 },
      { "kind": "int64", "value": 2 },
      { "kind": "int64", "value": 1 }
    ]
  }
}
