{
  "packet_id": "FP-P2D-046",
  "case_id": "series_dropna_no_missing_strict",
  "mode": "strict",
  "operation": "series_dropna",
  "left": {
    "name": "vals",
    "index": [
      { "kind": "utf8", "value": "r1" },
      { "kind": "utf8", "value": "r2" }
    ],
    "values": [
      { "kind": "int64", "value": 5 },
      { "kind": "int64", "value": 6 }
    ]
  },
  "expected_series": {
    "index": [
      { "kind": "utf8", "value": "r1" },
      { "kind": "utf8", "value": "r2" }
    ],
    "values": [
      { "kind": "int64", "value": 5 },
      { "kind": "int64", "value": 6 }
    ]
  }
}
