{
  "packet_id": "FP-P2D-048",
  "case_id": "series_isnull_all_present_hardened",
  "mode": "hardened",
  "operation": "series_isnull",
  "left": {
    "name": "vals",
    "index": [
      { "kind": "utf8", "value": "r1" },
      { "kind": "utf8", "value": "r2" },
      { "kind": "utf8", "value": "r3" }
    ],
    "values": [
      { "kind": "utf8", "value": "a" },
      { "kind": "utf8", "value": "b" },
      { "kind": "utf8", "value": "c" }
    ]
  },
  "expected_series": {
    "index": [
      { "kind": "utf8", "value": "r1" },
      { "kind": "utf8", "value": "r2" },
      { "kind": "utf8", "value": "r3" }
    ],
    "values": [
      { "kind": "bool", "value": false },
      { "kind": "bool", "value": false },
      { "kind": "bool", "value": false }
    ]
  }
}
