{
  "packet_id": "FP-P2D-045",
  "case_id": "series_isna_all_missing_strict",
  "mode": "strict",
  "operation": "series_isna",
  "left": {
    "name": "vals",
    "index": [
      { "kind": "utf8", "value": "a" },
      { "kind": "utf8", "value": "b" },
      { "kind": "utf8", "value": "c" }
    ],
    "values": [
      { "kind": "null", "value": "null" },
      { "kind": "null", "value": "na_n" },
      { "kind": "null", "value": "na_t" }
    ]
  },
  "expected_series": {
    "index": [
      { "kind": "utf8", "value": "a" },
      { "kind": "utf8", "value": "b" },
      { "kind": "utf8", "value": "c" }
    ],
    "values": [
      { "kind": "bool", "value": true },
      { "kind": "bool", "value": true },
      { "kind": "bool", "value": true }
    ]
  }
}
