{
  "packet_id": "FP-P2D-041",
  "case_id": "series_any_all_falsy_hardened",
  "mode": "hardened",
  "operation": "series_any",
  "left": {
    "name": "vals",
    "index": [
      { "kind": "utf8", "value": "r1" },
      { "kind": "utf8", "value": "r2" },
      { "kind": "utf8", "value": "r3" },
      { "kind": "utf8", "value": "r4" },
      { "kind": "utf8", "value": "r5" }
    ],
    "values": [
      { "kind": "bool", "value": false },
      { "kind": "bool", "value": false },
      { "kind": "bool", "value": false },
      { "kind": "bool", "value": false },
      { "kind": "null", "value": "null" }
    ]
  },
  "expected_bool": false
}
