{
  "packet_id": "FP-P2C-003",
  "case_id": "series_add_duplicate_labels_hardened_utf8",
  "mode": "hardened",
  "operation": "series_add",
  "left": {
    "name": "lhs",
    "index": [
      { "kind": "utf8", "value": "k" },
      { "kind": "utf8", "value": "k" }
    ],
    "values": [
      { "kind": "int64", "value": 4 },
      { "kind": "int64", "value": 8 }
    ]
  },
  "right": {
    "name": "rhs",
    "index": [
      { "kind": "utf8", "value": "k" }
    ],
    "values": [
      { "kind": "int64", "value": 1 }
    ]
  },
  "expected_series": {
    "index": [
      { "kind": "utf8", "value": "k" },
      { "kind": "utf8", "value": "k" }
    ],
    "values": [
      { "kind": "int64", "value": 5 },
      { "kind": "int64", "value": 9 }
    ]
  }
}
